question_id,question,query_type,correct_verdict,correct_answer,verifier_verdict,caugag_refused,caugag_response,vanilla_response,rag_response,graphrag_response
ALARM_TRUE_0,Does HYPOVOLEMIA directly cause LVEDVOLUME?,direction,VERIFIED,yes,VERIFIED,False,"Yes, the causal graph has verified that HYPOVOLEMIA directly causes LVEDVOLUME. 

Directed path: HYPOVOLEMIA -> LVEDVOLUME","No, hypovolemia does not directly cause left ventricular end-diastolic volume (LVEDV). 

Hypovolemia is a state of decreased blood volume, which can lead to decreased preload. Decreased preload can then lead to decreased LVEDV, but it's a two-step process. The direct cause of decreased LVEDV is the decreased preload, not hypovolemia itself.","To determine if hypovolemia directly causes left ventricular end-diastolic volume (LVEDV), we need to consider the underlying physiological mechanisms.

Hypovolemia refers to a decrease in blood volume, which can lead to a decrease in preload. Preload is the initial stretching of the cardiac myocytes prior to contraction, and it is directly related to the volume of blood in the ventricle at the end of diastole (LVEDV). When blood volume decreases, the ventricle receives less blood, resulting in a decrease in LVEDV.

However, to establish direct causation using the backdoor criterion, we need to ensure that there are no common causes or confounding variables that could influence both hypovolemia and LVEDV. In this case, it's unlikely that there are common causes or confounding variables that would explain the relationship between hypovolemia and LVEDV.

Using d-separation, we can block the path between hypovolemia and LVEDV by conditioning on variables that are directly related to the physiological mechanisms, such as cardiac output, heart rate, and contractility. However, in this case, the relationship between hypovolemia and LVEDV is more direct and less influenced by other variables.

Therefore, based on the underlying physiological mechanisms and the lack of common causes or confounding variables, it is reasonable to conclude that hypovolemia directly causes a decrease in LVEDV.

To establish this relationship more formally, we would need to use a causal diagram or a structural equation model to represent the relationships between hypovolemia, LVEDV, and other relevant variables. However, based on the information provided, it is likely that hypovolemia directly causes a decrease in LVEDV.","Yes, HYPOVOLEMIA directly causes LVEDVOLUME. This is a known causal relationship from the graph."
ALARM_TRUE_1,Is there a direct causal effect of HYPOVOLEMIA on STROKEVOLUME?,direction,VERIFIED,yes,VERIFIED,False,"Yes, there is a direct causal effect of HYPOVOLEMIA on STROKEVOLUME. 

Causal relationship: HYPOVOLEMIA causally affects STROKEVOLUME.

Directed path: HYPOVOLEMIA -> STROKEVOLUME

This relationship has been verified with no confounders.","Yes, there is a direct causal effect of hypovolemia on stroke volume. 

Hypovolemia is a condition characterized by a decrease in the volume of blood in the circulatory system. When blood volume decreases, the heart has to pump more forcefully to maintain adequate blood pressure and perfusion of vital organs. 

As a result, stroke volume (the amount of blood pumped by the heart per beat) typically increases in response to hypovolemia to compensate for the reduced blood volume. This is a compensatory mechanism to maintain cardiac output and ensure adequate blood flow to the body's tissues.

However, if the hypovolemia is severe or prolonged, the heart may eventually become unable to compensate, leading to a decrease in stroke volume and potentially even cardiac arrest.","To determine if there's a direct causal effect of HYPOVOLEMIA on STROKEVOLUME, we need to consider the causal graph and the backdoor criterion.

However, the context provided doesn't contain information about HYPOVOLEMIA and STROKEVOLUME. To answer this question, we would need to know the causal relationships between these variables.

But, assuming a hypothetical causal graph where HYPOVOLEMIA affects STROKEVOLUME directly or indirectly, we can use the backdoor criterion to identify confounding variables that might affect the causal relationship.

The backdoor criterion states that a set Z satisfies the backdoor criterion relative to (X,Y) if no variable in Z is a descendant of X, and Z blocks every path between X and Y that contains an arrow into X.

If we consider HYPOVOLEMIA as X and STROKEVOLUME as Y, we need to identify the set Z that blocks all backdoor paths between HYPOVOLEMIA and STROKEVOLUME.

Without specific information about the causal relationships between HYPOVOLEMIA and STROKEVOLUME, it's challenging to determine the direct causal effect.

However, in the context of protein signaling, we can see that PKA regulates Raf, Mek, Akt, JNK, P38, which are part of the MAPK cascade. This suggests that PKA can have an indirect effect on downstream proteins.

If we assume a similar mechanism for HYPOVOLEMIA and STROKEVOLUME, we might need to consider variables that are affected by HYPOVOLEMIA and also affect STROKEVOLUME.

To determine the direct causal effect of HYPOVOLEMIA on STROKEVOLUME, we would need more information about the causal relationships between these variables.

But, if we consider the do-calculus, P(Y|do(X=x)) is the interventional distribution when X is set by external intervention. The do-operator removes all incoming edges to X in the causal graph.

In this case, if we set HYPOVOLEMIA to a specific value using an external intervention, we can remove the incoming edges to HYPOVOLEMIA and determine the direct causal effect on STROKEVOLUME.

However, this would require more information about the causal relationships between HYPOVOLEMIA and STROKEVOLUME.

In summary, without specific information about the causal relationships between HYPOVOLEMIA and STROKEVOLUME, it's challenging to determine the direct causal effect.","Yes, there is a direct causal effect of HYPOVOLEMIA on STROKEVOLUME. This is stated in the known causal relationships: HYPOVOLEMIA directly causes STROKEVOLUME."
ALARM_TRUE_2,Does LVEDVOLUME directly affect STROKEVOLUME?,direction,VERIFIED,yes,VERIFIED,False,"The causal graph has VERIFIED that LVEDVOLUME causally affects STROKEVOLUME. 

Causal relationship: LVEDVOLUME directly affects STROKEVOLUME.","Yes, LVEDVOLUME (Left Ventricular End-Diastolic Volume) can directly affect STROKEVOLUME (the amount of blood pumped by the left ventricle of the heart in one contraction). 

The Frank-Starling mechanism describes the relationship between LVEDVOLUME and STROKEVOLUME. According to this mechanism, when the LVEDVOLUME increases, the ventricle stretches and becomes more compliant. This increased compliance allows the ventricle to generate more force and pump more blood with each contraction, resulting in an increase in STROKEVOLUME.","To determine if LVEDVOLUME directly affects STROKEVOLUME, we need to consider the causal relationship between these two variables.

In the context of cardiology, LVEDVOLUME (Left Ventricular End-Diastolic Volume) is a measure of the volume of blood in the left ventricle at the end of diastole, while STROKEVOLUME (Stroke Volume) is the amount of blood pumped by the left ventricle with each beat.

Based on the backdoor criterion, we need to identify a set Z that blocks every path between LVEDVOLUME and STROKEVOLUME that contains an arrow into LVEDVOLUME. 

However, in this case, we can use our knowledge of cardiology to infer the relationship. The relationship between LVEDVOLUME and STROKEVOLUME is complex and involves multiple variables. However, one of the key factors is the contractility of the left ventricle, which is influenced by various factors including the volume of blood in the ventricle.

A common cause of the relationship between LVEDVOLUME and STROKEVOLUME is the Frank-Starling mechanism, which states that the stroke volume of the heart increases in response to an increase in the volume of blood in the ventricle, up to a point. This is because the increased volume stretches the cardiac myocytes, leading to an increase in the force of contraction.

Therefore, based on the backdoor criterion and our knowledge of cardiology, we can conclude that LVEDVOLUME indirectly affects STROKEVOLUME through the Frank-Starling mechanism, but it does not directly affect STROKEVOLUME.

To establish a direct causal relationship, we would need to identify a direct causal link between LVEDVOLUME and STROKEVOLUME, which is not supported by the current understanding of cardiology.","Yes, LVEDVOLUME directly affects STROKEVOLUME. This is because we have two known causal relationships:

1. LVEDVOLUME directly causes STROKEVOLUME
2. HYPOVOLEMIA directly causes LVEDVOLUME and HYPOVOLEMIA directly causes STROKEVOLUME, but we can't conclude that LVEDVOLUME directly causes STROKEVOLUME from these two relationships alone. However, we also know that LVEDVOLUME directly causes STROKEVOLUME."
